{
    "levelName": "seventh_level",
    "levelDescription": "Implementa obstáculos mace com movimento vertical",
    "levelID": "76278262",
    "levelOrder": 60,
    "ffType": "JK",
    "clockCicles": 8,
    "activeClockEdge": "rising",  
    "jSignal": "000011 111000 000011 100001 111001 111000 001111 000000 001111",
    "kSignal": "001111 110000 000001 111000 011111 100001 111100 001110 000000",
    "clearSignal": "111111 111000 011111 110000 011111 111111 100011 111110 000000",
    "asyncActive": "low", 
    "ceiling": "111111 111111 111111 111111 111111 110001 111111 111111 111111 111111",
    "floor": "111111 111111 110001 111001 111111 111111 111111 111111 111111 111111",
    "obstacles": [
        {
            "obstacleName": "Mace",
            "startX": 4,
            "startY": 1,
            "speed": 1,
            "horizontalDistance": 5,
            "verticalDistance": 0,
            "starterCorner": "bottom-left",
            "clockwise": true
        },
        {
            "obstacleName": "Mace",
            "startX": 15,
            "startY": 2,
            "speed": 1,
            "horizontalDistance": 0,
            "verticalDistance": 3,
            "starterCorner": "bottom-right",
            "clockwise": true
        },
        {
            "obstacleName": "Mace",
            "startX": 27,
            "startY": 1,
            "speed": 2,
            "horizontalDistance": 0,
            "verticalDistance": 4,
            "starterCorner": "bottom-left",
            "clockwise": true
        },
        {
            "obstacleName": "Mace",
            "startX": 32,
            "startY": 1,
            "speed": 1,
            "horizontalDistance": 5,
            "verticalDistance": 0,
            "starterCorner": "bottom-left",
            "clockwise": true
        },
        {
            "obstacleName": "Mace",
            "startX": 42,
            "startY": 3,
            "speed": 3,
            "horizontalDistance": 5,
            "verticalDistance": 0,
            "starterCorner": "bottom-left",
            "clockwise": true
        }
    ]
}
