{
    "levelName": "third_level",
    "levelDescription": "implementa obstáculos mace fixos que incentivam a mudança de gravidade e uso do impulso",
    "levelID": "48628629",
    "levelOrder": 30,
    "ffType": "JK",
    "clockCicles": 7,
    "activeClockEdge": "rising",
    "jSignal": "000011 111000 000000 011100 000011 111100 011111 111111",
    "kSignal": "000000 011100 000011 111100 000111 100011 100011 111111",
    "floor": "111111 111111 100111 111111 000111 111111 110001 111111 111111 111111 111",
    "ceiling": " 000001 111111 100001 111111 100001 111111 110001 111111 111111 111111 111",
    "obstacles": [
        {
            "obstacleName": "Mace",
            "startX": 9,
            "startY": 1,
            "speed": 0,
            "horizontalDistance": 0,
            "verticalDistance": 0,
            "starterCorner": "bottom-left",
            "clockwise": true
        },
        {
            "obstacleName": "Mace",
            "startX": 20,
            "startY": 4,
            "speed": 0,
            "horizontalDistance": 0,
            "verticalDistance": 0,
            "starterCorner": "top-left",
            "clockwise": true
        },
        {
            "obstacleName": "Mace",
            "startX": 32,
            "startY": 1,
            "speed": 0,
            "horizontalDistance": 0,
            "verticalDistance": 0,
            "starterCorner": "bottom-left",
            "clockwise": true
        },
        {
            "obstacleName": "Mace",
            "startX": 39,
            "startY": 3,
            "speed": 0,
            "horizontalDistance": 0,
            "verticalDistance": 0,
            "starterCorner": "top-left",
            "clockwise": true
        }
    ]
}
