{
    "levelName": "fourth_level",
    "levelDescription": "implementa obstáculos mace móveis verticais para incentivar escolha prévia da saída",
    "levelID": "82972826",
    "levelOrder": 40,
    "ffType": "JK",
    "clockCicles": 7,
    "activeClockEdge": "rising",
    "jSignal": "000111 110000 111100 011111 111001 110011 110000 111111",
    "kSignal": "000000 001111 110000 111111 001111 100000 011111 001111",
    "floor": "111111 110001 111111 100001 111111 110001 100011 111111 111111 111111 111",
    "ceiling": "111111 111111 100011 111111 110001 100011 111111 111111 111111 111111 111",
    "obstacles": [
        {
            "obstacleName": "Mace",
            "startX": 3,
            "startY": 1,
            "speed": 2,
            "horizontalDistance": 0,
            "verticalDistance": 0,
            "starterCorner": "bottom-left",
            "clockwise": true
        },
        {
            "obstacleName": "Mace",
            "startX": 15,
            "startY": 1,
            "speed": 2,
            "horizontalDistance": 0,
            "verticalDistance": 4,
            "starterCorner": "bottom-left",
            "clockwise": true
        },
        {
            "obstacleName": "Mace",
            "startX": 26,
            "startY": 3,
            "speed": 2,
            "horizontalDistance": 0,
            "verticalDistance": 0,
            "starterCorner": "top-left",
            "clockwise": true
        },
        {
            "obstacleName": "Mace",
            "startX": 38,
            "startY": 1,
            "speed": 2,
            "horizontalDistance": 0,
            "verticalDistance": 4,
            "starterCorner": "bottom-left",
            "clockwise": true
        }
    ]
}
