{
    "levelName": "fifth_level",
    "levelDescription": "Implementa lógica nova de Preset sem sobreposição",
    "levelID": "526828642",
    "levelOrder": 50,
    "ffType": "JK",
    "clockCicles": 8,
    "activeClockEdge": "rising",
    "jSignal": "000111 111100 011100 111000 000011 110001 111000 011000 000111",
    "kSignal": "000111 100011 100001 110000 000111 000111 100111 111100 001111",
    "presetSignal": "111111 111111 111111 110011 111111 111111 111111 100011 111111",
    "asyncActive": "low",
    "ceiling": "111111 100011 111000 011111 111001 110001 111111 111111 111111",
    "floor": "111111 110001 110001 111111 111111 110001 111111 111111 111111",
    "obstacles": [
        {
            "obstacleName": "Mace",
            "startX": 3,
            "startY": 3,
            "speed": 2,
            "horizontalDistance": 0,
            "verticalDistance": 0,
            "starterCorner": "bottom-left",
            "clockwise": true
        },
        {
            "obstacleName": "Mace",
            "startX": 14,
            "startY": 4,
            "speed": 2,
            "horizontalDistance": 0,
            "verticalDistance": 0,
            "starterCorner": "bottom-left",
            "clockwise": true
        },
        {
            "obstacleName": "Mace",
            "startX": 33,
            "startY": 3,
            "speed": 2,
            "horizontalDistance": 0,
            "verticalDistance": 0,
            "starterCorner": "top-left",
            "clockwise": true
        },
        {
            "obstacleName": "Mace",
            "startX": 46,
            "startY": 2,
            "speed": 1,
            "horizontalDistance": 0,
            "verticalDistance": 0,
            "starterCorner": "top-left",
            "clockwise": true
        }
    ]
}
